{"success":true,"mission_id":"MISSION-20260725-WEBSITE-DAY1-060626","trace_id":"TRACE-20260725-WEBSITE-DAY1-060626","execution_id":"289","executor":"n8n","workflow_id":"aTVbw0a7MId3NCBH","workflow_name":"m8a_hk620_draft_20260708","action_type":"create_wordpress_draft_only","status":"completed","started_at":null,"finished_at":"2026-07-25T06:06:49.889Z","duration_ms":null,"retry_count":0,"result":{"type":"wordpress_draft","post_id":475,"post_status":"draft","draft_url":"https://woodmachinerynetwork.com/?p=475","edit_url":"https://woodmachinerynetwork.com/wp-admin/post.php?post=475&action=edit","title":"HK620 Skeleton Door Profile Edge Banding Machine for Stable Line Production","slug":"hk620-skeleton-door-profile-edge-banding-machine-for-stable-line-production","external_id":475,"external_url":"https://woodmachinerynetwork.com/?p=475","platform_status":"draft"},"error":null,"safety":{"draft_only":true,"publish":false,"delete_post":false,"update_published_post":false,"send_gmail":false,"upload_youtube":false,"old_workflow_called":false,"prohibited_workflow":"CWbGujhdNKFpa5JZ"},"compatibility":{"contract_version":"execution_response_contract_v1","legacy_webhook_response":null,"requires_execution_lookup":false,"normalization_source":"direct_webhook_response"}}